title,talk
Chequeo pre-inmersión,"Confirmar AST, estado del mar, roles del equipo, comunicaciones, oxígeno operativo y plan de rescate antes de iniciar."
Control de fatiga,"Ningún buzo debe iniciar si presenta fatiga, tos intensa, mareo, fiebre o consumo de fármacos incompatibles con la inmersión."
Uso de oxígeno,"Verificar presión disponible, mascarillas, conexiones y acceso expedito al kit de oxigenoterapia."
Embarque seguro,"Subida y bajada con tres puntos de apoyo, sin carga suelta y con chaleco salvavidas cuando corresponda."
Herramientas submarinas,"Revisar mangueras, uniones y puntos de corte. No intervenir equipos presurizados sin bloqueo y verificación."
